{
  "schema_version": "perfect-seed-plan-registry@1.0.0",
  "plan_id": "perfect-seed-repo-factory-v2",
  "definition_revision": 1,
  "scope_root": "loop_wiki/evolve-perfect-seed-repo-factory",
  "product": {
    "preserved_version": "perfect-seed-repo@1.1.0",
    "target_version": "perfect-seed-repo@2.0.0",
    "upgrade_policy": "explicit-migrator-only"
  },
  "progress_policy": {
    "source": "derived-only",
    "states": ["pending", "in_progress", "implemented", "verified", "admitted", "repair_required"],
    "projection_path_pattern": "_engine-run/progress-projection.<head>.json",
    "status_fields_forbidden_in_definition": true,
    "human_admit_required": true
  },
  "commit_policy": {
    "card_schema": "perfect-seed-molecular-index-card@1.0.0",
    "candidate_commit_per_work_item": 1,
    "fields": ["Work-Item", "Slice", "Intent", "Scope", "Prompts", "Oracles", "Evidence"],
    "absolute_paths_forbidden": true,
    "volatile_axis_state_forbidden": true
  },
  "attestation_policy": {
    "axes": ["cq", "pu", "architecture"],
    "ref_pattern": "refs/attestations/<candidate>/<axis>/<profile-sha>/<attestation-sha>",
    "publish_mode": "create-only",
    "current_state": "derived-by-reopen"
  },
  "forgejo_policy": {
    "role": "recoverable-projection",
    "local_outbox_when_unavailable": true,
    "candidate_commit_allowed_without_readback": true,
    "merge_release_admit_require_readback": true
  },
  "rag_policy": {
    "candidates": ["lancedb", "sqlite-fts5"],
    "selection": "measured-spike",
    "truth_authority": false,
    "deletion_must_not_change_gates": true
  },
  "milestones": [
    {
      "milestone_id": "M01-v2-contracts-and-genesis",
      "title": "V2 contracts, schemas, Git genesis, and seed boundary",
      "depends_on": [],
      "work_item_ids": ["WI-01"],
      "patch_boundary": [
        "templates/repo/.perfect-seed/",
        "templates/template-metadata.json",
        "src/contracts.ts",
        "src/materialize.ts",
        "tests/seed_factory.test.ts"
      ],
      "deliverables": [
        "versioned v2 schema bundle",
        "seed-manifest ownership classes",
        "deterministic Git genesis",
        "standalone source/manifest bindings"
      ],
      "exit_criteria": [
        {
          "criterion_id": "EC-01A",
          "oracle_id": "OR-MECH-SCHEMA",
          "claim": "Every v2 registry, packet, envelope, manifest, and receipt validates without silently accepting unknown fields.",
          "evidence": ["schema conformance receipt"],
          "hollow_control": "unknown field and wrong-version fixtures fail nonzero"
        },
        {
          "criterion_id": "EC-01B",
          "oracle_id": "OR-BEH-STANDALONE",
          "claim": "A generated v2 product is a Git repo with reproducible genesis and can verify its seed boundary offline in a fresh clone.",
          "evidence": ["fresh-clone receipt", "genesis commit/tree binding"],
          "hollow_control": "missing .git or mutated seed-manifest member fails"
        }
      ]
    },
    {
      "milestone_id": "M02-architecture-perception",
      "title": "Intended/observed architecture graphs and conformance",
      "depends_on": ["M01-v2-contracts-and-genesis"],
      "work_item_ids": ["WI-02"],
      "patch_boundary": [
        "templates/repo/.perfect-seed/registries/",
        "templates/repo/.perfect-seed/schemas/",
        "templates/repo/src/perception/",
        "templates/repo/tests/"
      ],
      "deliverables": ["intended graph", "observed graph projector", "conformance and blind-spot projection"],
      "exit_criteria": [
        {
          "criterion_id": "EC-02A",
          "oracle_id": "OR-MECH-GRAPH-CONFORMANCE",
          "claim": "Observed graph is bound to commit/tree and reports every missing required edge, unexpected edge, owner drift, closure leak, and opaque blind spot.",
          "evidence": ["architecture projection receipt"],
          "hollow_control": "remove one load-bearing edge while preserving filenames"
        },
        {
          "criterion_id": "EC-02B",
          "oracle_id": "OR-SEM-INTERFACE",
          "claim": "The declared observation closure is sufficient for terminal-slice and repo-level invariants without claiming universal perception.",
          "evidence": ["fresh zero-context semantic findings"],
          "hollow_control": "projection with an unreported dynamic edge is rejected"
        }
      ]
    },
    {
      "milestone_id": "M03-work-item-closure",
      "title": "Work-Item, capability packet, and terminal envelope",
      "depends_on": ["M01-v2-contracts-and-genesis", "M02-architecture-perception"],
      "work_item_ids": ["WI-03"],
      "patch_boundary": [
        "templates/repo/.perfect-seed/schemas/",
        "templates/repo/work-items/",
        "templates/repo/src/perception/",
        "templates/repo/tests/"
      ],
      "deliverables": [
        "local canonical Work-Item",
        "immutable capability packet",
        "one-attempt lease envelope",
        "terminal closure validator"
      ],
      "exit_criteria": [
        {
          "criterion_id": "EC-03A",
          "oracle_id": "OR-MECH-WORK-ITEM",
          "claim": "One Work-Item binds one terminal slice, one declared path closure, one oracle set, and at most one candidate commit without storing mutable status.",
          "evidence": ["packet/envelope validation receipt"],
          "hollow_control": "scope or criterion drift under the same packet hash fails"
        },
        {
          "criterion_id": "EC-03B",
          "oracle_id": "OR-BEH-STANDALONE",
          "claim": "The capability packet and envelope bundle validates and dry-runs in a clean offline clone without the mother repo.",
          "evidence": ["portable execution-closure receipt"],
          "hollow_control": "remove an embedded manifest binding and rerun"
        }
      ]
    },
    {
      "milestone_id": "M04-three-local-skills",
      "title": "Three standalone repo-local skills",
      "depends_on": ["M03-work-item-closure"],
      "work_item_ids": ["WI-04"],
      "patch_boundary": [
        "templates/repo/.agents/skills/seed-repo-operator/",
        "templates/repo/.agents/skills/repo-neural-perception/",
        "templates/repo/.agents/skills/repo-terminal-operator/",
        "templates/repo/tests/"
      ],
      "deliverables": [
        "read-only exact-20 reason interface",
        "read-only perceive interface",
        "lease-bound execute interface",
        "forbidden-capability tests"
      ],
      "exit_criteria": [
        {
          "criterion_id": "EC-04A",
          "oracle_id": "OR-BEH-SKILL-BOUNDARY",
          "claim": "Reason, perceive, and execute skills operate standalone and each rejects mutation or authority outside its declared role.",
          "evidence": ["three skill conformance receipts"],
          "hollow_control": "each skill attempts one forbidden action and receives typed failure"
        },
        {
          "criterion_id": "EC-04B",
          "oracle_id": "OR-BEH-TWENTY-CALL",
          "claim": "The reason skill still executes exactly twenty dependency-valid, non-constant local functions over the repo evidence.",
          "evidence": ["twenty-call behavioral receipt"],
          "hollow_control": "twenty constant-return handlers fail semantic behavior"
        }
      ]
    },
    {
      "milestone_id": "M05-cq0-incremental-gate",
      "title": "Incremental low-cost CQ-0",
      "depends_on": ["M03-work-item-closure", "M04-three-local-skills"],
      "work_item_ids": ["WI-05"],
      "patch_boundary": [
        "templates/repo/scripts/cq0/",
        "templates/repo/package.json",
        "templates/repo/src/",
        "templates/repo/tests/",
        "src/run_generated_fast_quality.ts"
      ],
      "deliverables": [
        "changed-path format and typed lint",
        "affected TypeScript project closure",
        "repo dependency-boundary check",
        "full-repo fallback",
        "declared/actual scope receipt"
      ],
      "exit_criteria": [
        {
          "criterion_id": "EC-05A",
          "oracle_id": "OR-BEH-CQ0",
          "claim": "CQ-0 runs minimum lineage, changed-path format/lint, strict affected project closure, dependency boundary, and focused behavior before candidate commit.",
          "evidence": ["perfect-seed-cq0-receipt@2.0.0"],
          "hollow_control": "one failing fixture per CQ-0 stage leaves HEAD unchanged"
        },
        {
          "criterion_id": "EC-05B",
          "oracle_id": "OR-BEH-CQ0-CLOSURE",
          "claim": "Affected closure matches full-repo detection for cross-project imports; uncertain closure records fallback and checks the full repo.",
          "evidence": ["incremental/full comparison receipt"],
          "hollow_control": "change upstream package and break downstream consumer"
        }
      ]
    },
    {
      "milestone_id": "M06-molecular-candidate-commit",
      "title": "Candidate molecular commit card and minimum lineage",
      "depends_on": ["M05-cq0-incremental-gate"],
      "work_item_ids": ["WI-06"],
      "patch_boundary": [
        "templates/repo/.githooks/",
        "templates/repo/scripts/lineage/",
        "templates/repo/.perfect-seed/prompt-templates/",
        "templates/repo/tests/"
      ],
      "deliverables": [
        "seven-field repo-relative commit card",
        "fixed/automatic/emergent prompt bindings",
        "content-addressed lineage manifest",
        "candidate-not-admitted semantics"
      ],
      "exit_criteria": [
        {
          "criterion_id": "EC-06A",
          "oracle_id": "OR-BEH-COMMIT-CARD",
          "claim": "A candidate commit is accepted only after CQ-0 and its seven stable index-card fields bind prompt roles, oracles, packet, and evidence without absolute paths.",
          "evidence": ["minimum-lineage gate receipt", "candidate commit/tree"],